<?xml version="1.0"?>
<!DOCTYPE Report
[
<!ELEMENT Report (General ,(Doc|BPT)) >
<!ATTLIST Report ver CDATA #REQUIRED tmZone CDATA #REQUIRED>

<!ELEMENT General ( DocLocation ) >
<!ATTLIST General productName CDATA #REQUIRED productVer CDATA #REQUIRED os CDATA #REQUIRED host CDATA #REQUIRED qcserver CDATA #IMPLIED qcproject CDATA #IMPLIED SolManSolutionId CDATA #IMPLIED SolManProjectId CDATA #IMPLIED SolManTestPlanId CDATA #IMPLIED SolManTestPackageId CDATA #IMPLIED SolManUserInfoData CDATA #IMPLIED  >

<!ELEMENT BPT (DName,Res,DVer?,TSet?,TInst?,NodeArgs,AdditionalInfo*,Doc*) >
<!ATTLIST BPT rID ID #REQUIRED >

<!ELEMENT Doc (DName,ConfName?,Res,DVer?,TSet?,TInst?,RunType?,DT?,AdditionalInfo*,Step*,DIter*,Step*,Action*,Doc*,Summary?,TestMaintenanceSummary*,NodeArgs?) >
<!ATTLIST Doc rID ID #REQUIRED type (Test|BC|BPTWrapperTest|Flow|Group|Action) "Test" productName CDATA #REQUIRED BCIter CDATA #IMPLIED >

<!ELEMENT RunType ( #PCDATA )>
<!ATTLIST RunType fmStep (False|True) "False" batch (False|True) "False" upDesc (False|True) "False" upChk (False|True) "False" upAS (False|True) "False">

<!ELEMENT DName ( #PCDATA ) >

<!ELEMENT ConfName ( #PCDATA ) >

<!ELEMENT Res ( #PCDATA ) >

<!ELEMENT AdditionalInfo (AdditionalDataName,AdditionalDataValue ) >

<!ELEMENT AdditionalDataName ( #PCDATA ) >

<!ELEMENT AdditionalDataValue ( #PCDATA ) >

<!ELEMENT DVer ( #PCDATA ) >

<!ELEMENT TSet ( #PCDATA ) >

<!ELEMENT TInst ( #PCDATA ) >

<!ELEMENT DIter (Step*,Action+,Summary?,NodeArgs)>
<!ATTLIST DIter rID ID #REQUIRED iterID CDATA #REQUIRED>

<!ELEMENT DocLocation ( #PCDATA )>

<!ELEMENT Action (AName,AIter*,(Step|HtmlStep|Action)*, Summary,ActionMaintenanceSummary*, NodeArgs ) >
<!ATTLIST Action rID ID #REQUIRED>

<!ELEMENT AIter ((Step|HtmlStep|Action)*,DataMapping?, Summary?,NodeArgs) >
<!ATTLIST AIter rID ID #REQUIRED iterID CDATA #REQUIRED isCountable (False|True) "False" >

<!ELEMENT AName ( #PCDATA ) >

<!ELEMENT TestMaintenanceSummary (ActionMaintenanceSummary*) >
<!ATTLIST TestMaintenanceSummary ObjectsAdded CDATA #REQUIRED ObjectsUpdated CDATA #REQUIRED StepsUpdated CDATA #REQUIRED StepsComments CDATA #REQUIRED><!ELEMENT ActionMaintenanceSummary (ObjectChange* ) >
<!ATTLIST ActionMaintenanceSummary Action CDATA #REQUIRED Objects CDATA #REQUIRED Updated CDATA #REQUIRED LinesTotal CDATA #REQUIRED Added CDATA #REQUIRED LinesUpdated CDATA #REQUIRED>

<!ELEMENT ObjectChange  (Hierarchy, PropertyChangeList* ) >
<!ATTLIST ObjectChange Operation CDATA #IMPLIED OriginalRepository CDATA #IMPLIED>

<!ELEMENT PropertyChangeList (PropertyDef*) >

<!ELEMENT PropertyDef (OriginalValue, NewValue) >
<!ATTLIST PropertyDef PropName CDATA #REQUIRED OriginRegularExpression (True|False) "False" NewRegularExpression (True|False) "False" AddedProperty (True|False) "False" >

<!ELEMENT OriginalValue ( #PCDATA )>

<!ELEMENT NewValue ( #PCDATA )>

<!ELEMENT Hierarchy  (ObjectName, Hierarchy*) >
<!ATTLIST Hierarchy MicClass CDATA #REQUIRED>

<!ELEMENT ObjectName  ( #PCDATA ) >

<!ELEMENT Step (Obj,Details,Time,TimeTick* ,(Step|HtmlStep|Doc)*, DataMapping?, NodeArgs) >
<!ATTLIST Step rID ID #REQUIRED retval CDATA #IMPLIED>

<!ELEMENT HtmlStep (HTML,TimeTick*,(Step|HtmlStep|Doc)*,NodeArgs) >
<!ATTLIST HtmlStep rID ID #REQUIRED >

<!ELEMENT Obj ( #PCDATA ) >
<!ATTLIST Obj plainTxt (False|True) "True">

<!ELEMENT Details ( #PCDATA ) >
<!ATTLIST Details plainTxt (False|True) "True">

<!ELEMENT Time ( #PCDATA ) >

<!ELEMENT HTML ( #PCDATA ) >

<!ELEMENT Disp ( #PCDATA ) >

<!ELEMENT TimeTick ( #PCDATA ) >

<!ELEMENT DataMapping ( DataMappedItem* )>
<!ELEMENT DataMappedItem EMPTY >
<!ATTLIST DataMappedItem dsName CDATA #REQUIRED >
<!ATTLIST DataMappedItem rowId CDATA #REQUIRED >

<!ELEMENT NodeArgs (Disp,TopPane?,BtmPane?,ExtendedInfo? )>
<!ATTLIST NodeArgs eType CDATA #REQUIRED icon CDATA #REQUIRED nRep CDATA #REQUIRED UserNote CDATA #IMPLIED filter (False|True) "True">
<!ATTLIST NodeArgs status (Passed|Failed|Done|Warning|Information) "Done">
<!ATTLIST NodeArgs iconSel CDATA #IMPLIED nType CDATA #IMPLIED MovieMarker CDATA "">
<!ATTLIST NodeArgs Source CDATA #IMPLIED SourceLine CDATA #IMPLIED StepFlowItemKey CDATA #IMPLIED >

<!ELEMENT TopPane (Path)>

<!ELEMENT BtmPane ( (Path|WR)?,ASHilite?)>
<!ATTLIST BtmPane vType CDATA "HTML">

<!ELEMENT Path ( #PCDATA ) >

<!ELEMENT ASHilite ( #PCDATA ) >

<!ELEMENT WR ( #PCDATA ) >

<!ELEMENT ExtendedInfo ( StepData ) >

<!ATTLIST ExtendedInfo StepType CDATA #REQUIRED>
<!ELEMENT DT (NodeArgs) >
<!ATTLIST DT rID ID #REQUIRED>

<!ELEMENT Summary (Param*)>
<!ATTLIST Summary sTime CDATA #IMPLIED eTime CDATA #IMPLIED passed CDATA #IMPLIED failed CDATA #IMPLIED warnings CDATA #IMPLIED retval CDATA #IMPLIED stopped (False|True) "False" >

<!ELEMENT Param (ParamName,ParamVal)+ >
<!ATTLIST Param paramInOut (In|Out) "In">

<!ELEMENT ParamName ( #PCDATA ) >

<!ELEMENT ParamVal ( #PCDATA ) >

]
>
<Report ver="2.0" tmZone="India Standard Time">
<General productName="HP Unified Functional Testing" productVer="11.53" os="Windows 7" host="LH7U0CNU31897LH" qcserver="http://10.231.236.13:8080/qcbin" qcproject="CAS2_0.MPS"><DocLocation><![CDATA[C:\Govardhan\2.Automation\MA State Health Connector\OPTUM_ETAF_August_10\Driver Script]]></DocLocation></General>
<Doc rID="T1"   productName= "HP Unified Functional Testing"  >
<DName><![CDATA[Driver Script]]></DName>
<Res><![CDATA[TC1]]></Res>
<DT rID="T2">
<NodeArgs eType="Table" icon="2" nRep="4" filter="False" >
<Disp><![CDATA[Run-Time Data Table]]></Disp>
<BtmPane vType="Table" >
<Path><![CDATA[Default.xls]]></Path>
</BtmPane>
</NodeArgs>
</DT>
<Action rID="T3">
<AName><![CDATA[Action1]]></AName>
<Step rID="T4">
<Obj ><![CDATA[Start]]></Obj>
<Details ><![CDATA[Iteration1 started]]></Details>
<Time><![CDATA[8/10/2015 - 23:54:14]]></Time>
<TimeTick>1439231054</TimeTick>
<NodeArgs eType="User" icon="4" nRep="7" >
<Disp><![CDATA[Start]]></Disp>
</NodeArgs>
</Step>
<Step rID="T5">
<Obj ><![CDATA[Start : OpenApplication]]></Obj>
<Details ><![CDATA[Invoking Business component: OpenApplication]]></Details>
<Time><![CDATA[8/10/2015 - 23:54:14]]></Time>
<TimeTick>1439231054</TimeTick>
<NodeArgs eType="User" icon="4" nRep="8" >
<Disp><![CDATA[Start : OpenApplication]]></Disp>
</NodeArgs>
</Step>
<Step rID="T6">
<Obj plainTxt="False" ><![CDATA[SystemUtil]]></Obj>
<Details plainTxt="False" ><![CDATA[SystemUtil]]></Details>
<Time><![CDATA[8/10/2015 - 23:54:20]]></Time>
<TimeTick>1439231060</TimeTick>
<Step rID="T7">
<Obj plainTxt="False" ><![CDATA[Run "iexplore.exe",1]]></Obj>
<Details plainTxt="False" ><![CDATA[Run "iexplore.exe",1]]></Details>
<Time><![CDATA[8/10/2015 - 23:54:20]]></Time>
<TimeTick>1439231060</TimeTick>
<NodeArgs eType="Replay" icon="5" nRep="12" status="Passed" >
<Disp><![CDATA[Run "iexplore.exe",1]]></Disp>
</NodeArgs>
</Step>
<NodeArgs eType="Replay" icon="5" nRep="11" status="Passed" >
<Disp><![CDATA[SystemUtil]]></Disp>
</NodeArgs>
</Step>
<Step rID="T8">
<Obj ><![CDATA[End : OpenApplication]]></Obj>
<Details ><![CDATA[Exiting Business component: OpenApplication]]></Details>
<Time><![CDATA[8/10/2015 - 23:54:33]]></Time>
<TimeTick>1439231073</TimeTick>
<NodeArgs eType="User" icon="4" nRep="13" >
<Disp><![CDATA[End : OpenApplication]]></Disp>
</NodeArgs>
</Step>
<Step rID="T9">
<Obj ><![CDATA[Start : LaunchGuerrilla]]></Obj>
<Details ><![CDATA[Invoking Business component: LaunchGuerrilla]]></Details>
<Time><![CDATA[8/10/2015 - 23:54:33]]></Time>
<TimeTick>1439231073</TimeTick>
<NodeArgs eType="User" icon="4" nRep="14" >
<Disp><![CDATA[Start : LaunchGuerrilla]]></Disp>
</NodeArgs>
</Step>
<Step rID="T10">
<Obj plainTxt="False" ><![CDATA[SystemUtil]]></Obj>
<Details plainTxt="False" ><![CDATA[SystemUtil]]></Details>
<Time><![CDATA[8/10/2015 - 23:54:33]]></Time>
<TimeTick>1439231073</TimeTick>
<Step rID="T11">
<Obj plainTxt="False" ><![CDATA[Run "iexplore.exe",1]]></Obj>
<Details plainTxt="False" ><![CDATA[Run "iexplore.exe",1]]></Details>
<Time><![CDATA[8/10/2015 - 23:54:33]]></Time>
<TimeTick>1439231073</TimeTick>
<NodeArgs eType="Replay" icon="5" nRep="18" status="Passed" >
<Disp><![CDATA[Run "iexplore.exe",1]]></Disp>
</NodeArgs>
</Step>
<NodeArgs eType="Replay" icon="5" nRep="17" status="Passed" >
<Disp><![CDATA[SystemUtil]]></Disp>
</NodeArgs>
</Step>
<Step rID="T12">
<Obj plainTxt="False" ><![CDATA[[ Page ].Exist]]></Obj>
<Details plainTxt="False" ><![CDATA["Object does not exist"]]></Details>
<Time><![CDATA[8/10/2015 - 23:54:49]]></Time>
<TimeTick>1439231089</TimeTick>
<NodeArgs eType="Replay" icon="6" nRep="24" >
<Disp><![CDATA[[ Page ].Exist]]></Disp>
</NodeArgs>
</Step>
<Step rID="T13">
<Obj plainTxt="False" ><![CDATA[[ Notification: Policy Acknowledgement ].Exist]]></Obj>
<Details plainTxt="False" ><![CDATA["Object exists"]]></Details>
<Time><![CDATA[8/10/2015 - 23:54:54]]></Time>
<TimeTick>1439231094</TimeTick>
<NodeArgs eType="Replay" icon="7" nRep="25" >
<Disp><![CDATA[[ Notification: Policy Acknowledgement ].Exist]]></Disp>
</NodeArgs>
</Step>
<Step rID="T14">
<Obj ><![CDATA[Browser -> Guerilla]]></Obj>
<Details ><![CDATA[Browser successfullly launched and navigated to URL -> https://www.guerrillamail.com/login/]]></Details>
<Time><![CDATA[8/10/2015 - 23:54:55]]></Time>
<TimeTick>1439231095</TimeTick>
<NodeArgs eType="User" icon="4" nRep="26" status="Passed" >
<Disp><![CDATA[Browser -> Guerilla]]></Disp>
</NodeArgs>
</Step>
<Step rID="T15">
<Obj ><![CDATA[End : LaunchGuerrilla]]></Obj>
<Details ><![CDATA[Exiting Business component: LaunchGuerrilla]]></Details>
<Time><![CDATA[8/10/2015 - 23:54:55]]></Time>
<TimeTick>1439231095</TimeTick>
<NodeArgs eType="User" icon="4" nRep="27" >
<Disp><![CDATA[End : LaunchGuerrilla]]></Disp>
</NodeArgs>
</Step>
<Step rID="T16">
<Obj ><![CDATA[Start : Guerrilla_StoreMailID]]></Obj>
<Details ><![CDATA[Invoking Business component: Guerrilla_StoreMailID]]></Details>
<Time><![CDATA[8/10/2015 - 23:54:55]]></Time>
<TimeTick>1439231095</TimeTick>
<NodeArgs eType="User" icon="4" nRep="28" >
<Disp><![CDATA[Start : Guerrilla_StoreMailID]]></Disp>
</NodeArgs>
</Step>
<Step rID="T17">
<Obj plainTxt="False" ><![CDATA[[ Notification: Policy Acknowledgement ].Sync]]></Obj>
<Details plainTxt="False" ><![CDATA[]]></Details>
<Time><![CDATA[8/10/2015 - 23:54:55]]></Time>
<TimeTick>1439231095</TimeTick>
<NodeArgs eType="Replay" icon="7" nRep="30" >
<Disp><![CDATA[[ Notification: Policy Acknowledgement ].Sync]]></Disp>
</NodeArgs>
</Step>
<Step rID="T18">
<Obj plainTxt="False" ><![CDATA[[ Link ].Exist]]></Obj>
<Details plainTxt="False" ><![CDATA["Object does not exist"]]></Details>
<Time><![CDATA[8/10/2015 - 23:55:00]]></Time>
<TimeTick>1439231100</TimeTick>
<NodeArgs eType="Replay" icon="8" nRep="77" >
<Disp><![CDATA[[ Link ].Exist]]></Disp>
</NodeArgs>
</Step>
<Step rID="T19">
<Obj plainTxt="False" ><![CDATA[[ Click here to accept this statement and access the Internet. ].Exist]]></Obj>
<Details plainTxt="False" ><![CDATA["Object exists"]]></Details>
<Time><![CDATA[8/10/2015 - 23:55:00]]></Time>
<TimeTick>1439231100</TimeTick>
<NodeArgs eType="Replay" icon="8" nRep="78" >
<Disp><![CDATA[[ Click here to accept this statement and access the Internet. ].Exist]]></Disp>
</NodeArgs>
</Step>
<Step rID="T20">
<Obj plainTxt="False" ><![CDATA[[ Click here to accept this statement and access the Internet. ].Click]]></Obj>
<Details plainTxt="False" ><![CDATA[]]></Details>
<Time><![CDATA[8/10/2015 - 23:55:00]]></Time>
<TimeTick>1439231100</TimeTick>
<NodeArgs eType="Replay" icon="8" nRep="80" >
<Disp><![CDATA[[ Click here to accept this statement and access the Internet. ].Click]]></Disp>
</NodeArgs>
</Step>
<Step rID="T21">
<Obj ><![CDATA[Browser --> Guerrilla]]></Obj>
<Details ><![CDATA[Click action on 'Click here to accept this statement and access the Internet.' Link is performed successfully]]></Details>
<Time><![CDATA[8/10/2015 - 23:55:00]]></Time>
<TimeTick>1439231100</TimeTick>
<NodeArgs eType="User" icon="4" nRep="81" status="Passed" >
<Disp><![CDATA[Browser --> Guerrilla]]></Disp>
</NodeArgs>
</Step>
<Step rID="T22">
<Obj plainTxt="False" ><![CDATA[[ Link ]]]></Obj>
<Details plainTxt="False" ><![CDATA[Cannot identify the object "[ Link ]" (of class Link). Verify that this object's properties match an object currently displayed in your application.]]></Details>
<Time><![CDATA[8/10/2015 - 23:55:08]]></Time>
<TimeTick>1439231108</TimeTick>
<Step rID="T23">
<Obj plainTxt="False" ><![CDATA[[ Link ]]]></Obj>
<Details plainTxt="False" ><![CDATA[Object's physical description:<br>Text = Email<br>Mercury Class = Link<br>Html Tag = A<br>]]></Details>
<Time><![CDATA[8/10/2015 - 23:55:08]]></Time>
<TimeTick>1439231108</TimeTick>
<NodeArgs eType="Replay" icon="9" nRep="86" status="Warning" nType="Description" >
<Disp><![CDATA[[ Link ]]]></Disp>
<BtmPane vType="Mercury.SSHWeb" >
<Path><![CDATA[ZIP::Act1\Row0\ssf1.xml]]></Path>
<ASHilite><![CDATA[HIGHLIGHT PARAMS]]></ASHilite>
</BtmPane>
</NodeArgs>
</Step>
<NodeArgs eType="Replay" icon="8" nRep="85" status="Failed" nType="Run Error" >
<Disp><![CDATA[[ Link ]]]></Disp>
</NodeArgs>
</Step>
<Step rID="T24">
<Obj plainTxt="False" ><![CDATA[[ WebElement ].GetROProperty "innertext"]]></Obj>
<Details plainTxt="False" ><![CDATA[]]></Details>
<Time><![CDATA[8/10/2015 - 23:55:08]]></Time>
<TimeTick>1439231108</TimeTick>
<NodeArgs eType="Replay" icon="10" nRep="89" status="Warning" >
<Disp><![CDATA[[ WebElement ].GetROProperty "innertext"]]></Disp>
<BtmPane vType="Mercury.SSHWeb" >
<Path><![CDATA[ZIP::Act1\Row0\ssf2.xml]]></Path>
<ASHilite><![CDATA[HIGHLIGHT PARAMS]]></ASHilite>
</BtmPane>
</NodeArgs>
</Step>
<Step rID="T25">
<Obj plainTxt="False" ><![CDATA[[ WebElement ]]]></Obj>
<Details plainTxt="False" ><![CDATA[Cannot identify the object "[ WebElement ]" (of class WebElement). Verify that this object's properties match an object currently displayed in your application.]]></Details>
<Time><![CDATA[8/10/2015 - 23:55:08]]></Time>
<TimeTick>1439231108</TimeTick>
<Step rID="T26">
<Obj plainTxt="False" ><![CDATA[[ WebElement ]]]></Obj>
<Details plainTxt="False" ><![CDATA[Object's physical description:<br>Mercury Class = WebElement<br>Html Tag = SPAN<br>DHTML Class = editable button<br>]]></Details>
<Time><![CDATA[8/10/2015 - 23:55:08]]></Time>
<TimeTick>1439231108</TimeTick>
<NodeArgs eType="Replay" icon="9" nRep="91" status="Warning" nType="Description" >
<Disp><![CDATA[[ WebElement ]]]></Disp>
<BtmPane vType="Mercury.SSHWeb" >
<Path><![CDATA[ZIP::Act1\Row0\ssf3.xml]]></Path>
<ASHilite><![CDATA[HIGHLIGHT PARAMS]]></ASHilite>
</BtmPane>
</NodeArgs>
</Step>
<NodeArgs eType="Replay" icon="10" nRep="90" status="Failed" nType="Run Error" >
<Disp><![CDATA[[ WebElement ]]]></Disp>
</NodeArgs>
</Step>
<Step rID="T27">
<Obj plainTxt="False" ><![CDATA[[ WebList ].GetROProperty "value"]]></Obj>
<Details plainTxt="False" ><![CDATA[]]></Details>
<Time><![CDATA[8/10/2015 - 23:55:08]]></Time>
<TimeTick>1439231108</TimeTick>
<NodeArgs eType="Replay" icon="11" nRep="94" status="Warning" >
<Disp><![CDATA[[ WebList ].GetROProperty "value"]]></Disp>
<BtmPane vType="Mercury.SSHWeb" >
<Path><![CDATA[ZIP::Act1\Row0\ssf4.xml]]></Path>
<ASHilite><![CDATA[HIGHLIGHT PARAMS]]></ASHilite>
</BtmPane>
</NodeArgs>
</Step>
<Step rID="T28">
<Obj plainTxt="False" ><![CDATA[[ WebList ]]]></Obj>
<Details plainTxt="False" ><![CDATA[Cannot identify the object "[ WebList ]" (of class WebList). Verify that this object's properties match an object currently displayed in your application.]]></Details>
<Time><![CDATA[8/10/2015 - 23:55:09]]></Time>
<TimeTick>1439231109</TimeTick>
<Step rID="T29">
<Obj plainTxt="False" ><![CDATA[[ WebList ]]]></Obj>
<Details plainTxt="False" ><![CDATA[Object's physical description:<br>Mercury Class = WebList<br>Html Tag = SELECT<br>Html Id = gm-host-select<br>]]></Details>
<Time><![CDATA[8/10/2015 - 23:55:09]]></Time>
<TimeTick>1439231109</TimeTick>
<NodeArgs eType="Replay" icon="9" nRep="96" status="Warning" nType="Description" >
<Disp><![CDATA[[ WebList ]]]></Disp>
<BtmPane vType="Mercury.SSHWeb" >
<Path><![CDATA[ZIP::Act1\Row0\ssf5.xml]]></Path>
<ASHilite><![CDATA[HIGHLIGHT PARAMS]]></ASHilite>
</BtmPane>
</NodeArgs>
</Step>
<NodeArgs eType="Replay" icon="11" nRep="95" status="Failed" nType="Run Error" >
<Disp><![CDATA[[ WebList ]]]></Disp>
</NodeArgs>
</Step>
<Step rID="T30">
<Obj ><![CDATA[Output Value]]></Obj>
<Details ><![CDATA[Output value '@' written into the 'EmailID' column]]></Details>
<Time><![CDATA[8/10/2015 - 23:55:09]]></Time>
<TimeTick>1439231109</TimeTick>
<NodeArgs eType="User" icon="4" nRep="97" >
<Disp><![CDATA[Output Value]]></Disp>
</NodeArgs>
</Step>
<Step rID="T31">
<Obj ><![CDATA[Output Value]]></Obj>
<Details ><![CDATA[Output value 'Auto12' written into the 'UserName' column]]></Details>
<Time><![CDATA[8/10/2015 - 23:55:09]]></Time>
<TimeTick>1439231109</TimeTick>
<NodeArgs eType="User" icon="4" nRep="98" >
<Disp><![CDATA[Output Value]]></Disp>
</NodeArgs>
</Step>
<Step rID="T32">
<Obj ><![CDATA[Component --> Guerrilla_StoreMailID]]></Obj>
<Details ><![CDATA[Error Occured while processing the Business Component with Description ==> Cannot identify the object "[ WebList ]" (of class WebList). Verify that this object's properties match an object currently displayed in your application.]]></Details>
<Time><![CDATA[8/10/2015 - 23:55:09]]></Time>
<TimeTick>1439231109</TimeTick>
<NodeArgs eType="User" icon="4" nRep="99" status="Warning" >
<Disp><![CDATA[Component --> Guerrilla_StoreMailID]]></Disp>
</NodeArgs>
</Step>
<Step rID="T33">
<Obj plainTxt="False" ><![CDATA[Stop Run]]></Obj>
<Details plainTxt="False" ><![CDATA[Run stopped by user.]]></Details>
<Time><![CDATA[8/10/2015 - 23:55:19]]></Time>
<TimeTick>1439231119</TimeTick>
<NodeArgs eType="General" icon="12" nRep="100" >
<Disp><![CDATA[Stop Run]]></Disp>
</NodeArgs>
</Step>
<Summary sTime="8/10/2015 - 23:54:13" eTime="8/10/2015 - 23:55:19" passed="4" failed="3" warnings="6" ></Summary>
<NodeArgs eType="StartAction" icon="3" nRep="6" status="Failed" >
<Disp><![CDATA[Action1 Summary]]></Disp>
</NodeArgs>
</Action>
<Step rID="T34">
<Obj plainTxt="False" ><![CDATA[Stop Run]]></Obj>
<Details plainTxt="False" ><![CDATA[Run stopped by user.]]></Details>
<Time><![CDATA[8/10/2015 - 23:55:19]]></Time>
<TimeTick>1439231119</TimeTick>
<NodeArgs eType="General" icon="13" nRep="102" >
<Disp><![CDATA[Stop Run]]></Disp>
</NodeArgs>
</Step>
<Summary sTime="8/10/2015 - 23:54:12" eTime="8/10/2015 - 23:55:19" passed="4" failed="3" warnings="6" stopped="True" ><Param ><ParamName><![CDATA[TestCaseDescription]]></ParamName><ParamVal><![CDATA[Optum Id Creation with Guerilla Mail Id: No of Applicants : 2: Positive Data]]></ParamVal>
</Param>
<Param ><ParamName><![CDATA[TimeStamp]]></ParamName><ParamVal><![CDATA[Run_8-10-2015_11-54-02 PM]]></ParamVal>
</Param>
<Param ><ParamName><![CDATA[IterationMode]]></ParamName><ParamVal><![CDATA[oneIteration]]></ParamVal>
</Param>
<Param ><ParamName><![CDATA[CurrentScenario]]></ParamName><ParamVal><![CDATA[OptumTAF]]></ParamVal>
</Param>
<Param ><ParamName><![CDATA[CurrentTestCase]]></ParamName><ParamVal><![CDATA[TC1]]></ParamVal>
</Param>
<Param ><ParamName><![CDATA[StartIteration]]></ParamName><ParamVal><![CDATA[<Not Initialized>]]></ParamVal>
</Param>
<Param ><ParamName><![CDATA[EndIteration]]></ParamName><ParamVal><![CDATA[<Not Initialized>]]></ParamVal>
</Param>
</Summary>
<NodeArgs eType="StartTest" icon="1" nRep="3" status="Failed" >
<Disp><![CDATA[Test Driver Script Summary]]></Disp>
</NodeArgs>
</Doc>
</Report>